{
  "$schema": "http://json-schema.org/draft-07/schema#",
  "title": "color.wave plugin registry",
  "type": "object",
  "required": ["name", "version", "plugins"],
  "properties": {
    "name": { "type": "string" },
    "description": { "type": "string" },
    "homepage": { "type": "string", "format": "uri" },
    "version": { "type": "integer", "const": 1 },
    "updated": { "type": "string", "format": "date" },
    "plugins": {
      "type": "array",
      "items": {
        "type": "object",
        "required": ["id", "name", "latest"],
        "properties": {
          "id": {
            "type": "string",
            "pattern": "^[a-z][a-z0-9-]*$",
            "description": "Stable id, also used as the manifest.id at runtime"
          },
          "name": { "type": "string" },
          "description": { "type": "string" },
          "icon": { "type": "string", "description": "Single emoji or short text" },
          "author": { "type": "string" },
          "homepage": { "type": "string", "format": "uri" },
          "surfaces": {
            "type": "array",
            "items": { "type": "string" },
            "description": "Plugin API surfaces it touches (chat-input, panel-tabs, settings, timeline-clip-actions, composition-decorators, …)"
          },
          "permissions": {
            "type": "array",
            "items": { "type": "string" },
            "description": "Permission strings shown to the user on install (informational; not enforced yet)"
          },
          "latest": {
            "type": "object",
            "required": ["version", "url"],
            "properties": {
              "version": { "type": "string", "description": "Semver; published as tag <id>-v<version>" },
              "url": {
                "type": "string",
                "format": "uri",
                "description": "Direct download URL for the plugin's built JS — typically a GitHub release asset"
              },
              "publishedAt": { "type": "string", "format": "date-time" },
              "sha256": { "type": "string", "description": "Optional integrity hash" }
            }
          }
        }
      }
    }
  }
}
